{
  "$schema": "http://json-schema.org/draft-07/schema#",
  "type": "object",
  "properties": {
    "id": {
      "type": "string"
    },
    "tslFile": {
      "type": "string"
    },
    "enabled": {
      "type": "boolean"
    },
    "params": {
      "type": "object",
      "propertyNames": {
        "type": "string"
      },
      "additionalProperties": {}
    },
    "paramsMeta": {
      "type": "object",
      "propertyNames": {
        "type": "string"
      },
      "additionalProperties": {
        "type": "object",
        "properties": {
          "label": {
            "type": "string"
          },
          "min": {
            "type": "number"
          },
          "max": {
            "type": "number"
          },
          "step": {
            "type": "number"
          },
          "options": {
            "type": "object",
            "propertyNames": {
              "type": "string"
            },
            "additionalProperties": {
              "anyOf": [
                {
                  "type": "string"
                },
                {
                  "type": "number"
                },
                {
                  "type": "boolean"
                }
              ]
            }
          },
          "hidden": {
            "type": "boolean"
          }
        },
        "additionalProperties": false
      }
    },
    "staticDefines": {
      "type": "object",
      "propertyNames": {
        "type": "string"
      },
      "additionalProperties": {}
    },
    "debugData": {
      "type": "object",
      "properties": {
        "name": {
          "type": "string"
        },
        "description": {
          "type": "string"
        },
        "comments": {
          "type": "array",
          "items": {
            "type": "object",
            "properties": {
              "timestamp": {
                "type": "number"
              },
              "comment": {
                "type": "string"
              }
            },
            "required": [
              "timestamp",
              "comment"
            ],
            "additionalProperties": false
          }
        },
        "todo": {
          "type": "object",
          "propertyNames": {
            "type": "string"
          },
          "additionalProperties": {}
        },
        "debugObj": {
          "type": "object",
          "propertyNames": {
            "type": "string"
          },
          "additionalProperties": {}
        }
      },
      "additionalProperties": false
    },
    "userData": {
      "type": "object",
      "propertyNames": {
        "type": "string"
      },
      "additionalProperties": {}
    },
    "$schema": {
      "type": "string"
    },
    "__sourcePath": {
      "type": "string"
    },
    "__saveData": {
      "type": "object",
      "propertyNames": {
        "type": "string"
      },
      "additionalProperties": {
        "type": "array",
        "items": {
          "type": "object",
          "properties": {
            "__meta": {
              "type": "object",
              "properties": {
                "date": {
                  "type": "number"
                },
                "engineVersion": {
                  "type": "string",
                  "pattern": "^\\d+\\.\\d+\\.\\d+$"
                },
                "toolkitVersion": {
                  "type": "string",
                  "pattern": "^\\d+\\.\\d+\\.\\d+$"
                },
                "appVersion": {
                  "type": "string",
                  "pattern": "^\\d+\\.\\d+\\.\\d+$"
                }
              },
              "additionalProperties": false
            },
            "enabled": {
              "type": "boolean"
            },
            "params": {
              "type": "object",
              "propertyNames": {
                "type": "string"
              },
              "additionalProperties": {}
            },
            "staticDefines": {
              "type": "object",
              "propertyNames": {
                "type": "string"
              },
              "additionalProperties": {}
            },
            "debugData": {
              "type": "object",
              "properties": {
                "name": {
                  "type": "string"
                },
                "description": {
                  "type": "string"
                },
                "comments": {
                  "type": "array",
                  "items": {
                    "type": "object",
                    "properties": {
                      "timestamp": {
                        "type": "number"
                      },
                      "comment": {
                        "type": "string"
                      }
                    },
                    "required": [
                      "timestamp",
                      "comment"
                    ],
                    "additionalProperties": false
                  }
                },
                "todo": {
                  "type": "object",
                  "propertyNames": {
                    "type": "string"
                  },
                  "additionalProperties": {}
                },
                "debugObj": {
                  "type": "object",
                  "propertyNames": {
                    "type": "string"
                  },
                  "additionalProperties": {}
                }
              },
              "additionalProperties": false
            },
            "userData": {
              "type": "object",
              "propertyNames": {
                "type": "string"
              },
              "additionalProperties": {}
            }
          },
          "additionalProperties": false
        }
      }
    }
  },
  "required": [
    "id",
    "tslFile"
  ],
  "additionalProperties": false
}