{
  "$schema": "../../../../.schemas/postFx.schema.json",
  "id": "heroBloom",
  "tslFile": "examples/hubHero/heroBloom.tsl.ts",
  "enabled": true,
  "debugData": {
    "name": "Bloom (Hub hero)",
    "description": "three's BloomNode added over the incoming colour: what is brighter than the threshold glows."
  },
  "params": { "strength": 0.9, "radius": 0.5, "threshold": 0.85 },
  "paramsMeta": {
    "strength": { "label": "Strength", "min": 0, "max": 3, "step": 0.01 },
    "radius": { "label": "Radius", "min": 0, "max": 1, "step": 0.01 },
    "threshold": { "label": "Threshold", "min": 0, "max": 2, "step": 0.01 }
  }
}
